B1: SUB-BOARD I, INC.
B2: MONTHLY STIPEND PAYROLL SCHEDULE
B3: 2005 - 2006
B6: SERVICE MONTH | D6: TIME REPORT DUE | H6: PAY DAY
B8: AUGUST, 2005 | E8: =DATE(5,9,7) -> 2077 | H8: Fri, | I8: =DATE(5,9,16) -> 2086
B10: SEPTEMBER, 2005 | E10: =DATE(5,10,5) -> 2105 | H10: Fri, | I10: =I8+28 -> 2114
B12: OCTOBER, 2005 | E12: =DATE(5,11,2) -> 2133 | H12: Fri, | I12: =I10+28 -> 2142
B14: NOVEMBER, 2005 | E14: 38686 | H14: Fri, | I14: =+I12+28 -> 2170
B16: DECEMBER, 2005 | E16: 38700 | H16: Thurs, | I16: =+I14+13 -> 2183
B18: JANUARY, 2006 | E18: =DATE(6,2,8) -> 2231 | H18: Fri, | I18: =+I16+15+14+14+14 -> 2240
B20: FEBRUARY, 2006 | E20: =DATE(6,3,8) -> 2259 | H20: Thurs, | I20: =I18+27 -> 2267
B22: MARCH, 2006 | E22: =DATE(6,4,5) -> 2287 | H22: Fri, | I22: =I20+29 -> 2296
B24: APRIL, 2006 | E24: =DATE(6,5,3) -> 2315 | H24: Thurs, | I24: =I22+27 -> 2323
B26: First Half MAY, 2006 | D26: * | E26: =+E24+14 -> 2329 | H26: Thurs, | I26: =+I24+14 -> 2337
B28: Second Half MAY, 2006 | D28: * | E28: =+E26+14 -> 2343 | H28: Thurs, | I28: =+I26+14 -> 2351
B30: JUNE, 2006 | E30: =+E28+14+14 -> 2371 | H30: Thurs, | I30: =+I28+14+14 -> 2379
B32: JULY, 2006 | E32: =+E30+14+14+14 -> 2413 | H32: Thurs, | I32: =+I30+14+14+14 -> 2421
A35: * | B35: Because of IRS regulations regarding FICA exemption for students, the stipend for May will be
B36: split into two payments, one for the first half of May, and one for the second half of May.
B37: TWO time sheets must be submitted for May, one for the period 5/1-5/15, and the second for
B38: the period 5/16-5/31.
B40: Reduced hours will be in effect from Tuesday December 20, 2005 through Friday January 13, 2006,
B41: and from Monday March 13, 2006 through Friday March 17, 2006, and from Friday May 12, 2006
B42: through Friday, August 25, 2006
B44: REMINDER! Federal regulations require that appointment authorizations with I-9 attachments
B45: must be submitted to the Sub-Board I Accounting Office for all newly hired employees within
B46: three business days from their first day of work!