A2: BI-WEEKLY PAYROLL SCHEDULE
A3: 2005 - 2006
A5: Pay Period | E5: Time Sheets Due | I5: Pay Day
A7: =DATE(5,7,25) -> 2033 | B7: - | C7: =A7+13 -> 2046 | F7: =DATE(5,8,10) -> 2049 | I7: Thurs, | J7: =DATE(5,8,18) -> 2057
A9: =A7+14 -> 2047 | B9: - | C9: =C7+14 -> 2060 | F9: =F7+14 -> 2063 | I9: Fri, | J9: =J7+15 -> 2072
A11: =A9+14 -> 2061 | B11: - | C11: =C9+14 -> 2074 | F11: =F9+14 -> 2077 | I11: Fri, | J11: =+J9+14 -> 2086
A13: =A11+14 -> 2075 | B13: - | C13: =C11+14 -> 2088 | F13: =F11+14 -> 2091 | I13: Fri, | J13: =+J11+14 -> 2100
A15: =A13+14 -> 2089 | B15: - | C15: =C13+14 -> 2102 | F15: =F13+14 -> 2105 | I15: Fri, | J15: =J13+14 -> 2114
A17: =A15+14 -> 2103 | B17: - | C17: =C15+14 -> 2116 | F17: =F15+14 -> 2119 | I17: Fri, | J17: =J15+14 -> 2128
A19: =A17+14 -> 2117 | B19: - | C19: =C17+14 -> 2130 | F19: =F17+14 -> 2133 | I19: Fri, | J19: =J17+14 -> 2142
A21: =A19+14 -> 2131 | B21: - | C21: =C19+14 -> 2144 | F21: =F19+14 -> 2147 | I21: * Fri, | J21: =J19+14 -> 2156
A23: =A21+14 -> 2145 | B23: - | C23: =C21+14 -> 2158 | F23: =F21+14 -> 2161 | I23: Fri, | J23: =J21+14 -> 2170
A25: =A23+14 -> 2159 | B25: - | C25: =C23+14 -> 2172 | F25: =F23+14 -> 2175 | I25: ** Thurs, | J25: =J23+13 -> 2183
A27: =A25+14 -> 2173 | B27: - | C27: =C25+14 -> 2186 | F27: =+F25+14 -> 2189 | I27: Thurs, | J27: =+J25+14 -> 2197
A29: =A27+14 -> 2187 | B29: - | C29: =C27+14 -> 2200 | F29: =+F27+14 -> 2203 | I29: Fri, | J29: =+J27+15 -> 2212
A31: =A29+14 -> 2201 | B31: - | C31: =C29+14 -> 2214 | F31: =+F29+14 -> 2217 | I31: Fri, | J31: =+J29+14 -> 2226
A33: =A31+14 -> 2215 | B33: - | C33: =C31+14 -> 2228 | F33: =F31+14 -> 2231 | I33: Fri, | J33: =J31+14 -> 2240
A35: =A33+14 -> 2229 | B35: - | C35: =C33+14 -> 2242 | F35: =F33+14 -> 2245 | I35: Fri, | J35: =J33+14 -> 2254
A37: =A35+14 -> 2243 | B37: - | C37: =C35+14 -> 2256 | F37: =F35+14 -> 2259 | I37: ** Thurs, | J37: =J35+13 -> 2267
A39: =A37+14 -> 2257 | B39: - | C39: =C37+14 -> 2270 | F39: =F37+14 -> 2273 | I39: Fri, | J39: =J37+15 -> 2282
A41: =A39+14 -> 2271 | B41: - | C41: =C39+14 -> 2284 | F41: =F39+14 -> 2287 | I41: Fri, | J41: =J39+14-1+1 -> 2296
A43: =A41+14 -> 2285 | B43: - | C43: =C41+14 -> 2298 | F43: =F41+14 -> 2301 | I43: Fri, | J43: =J41+14 -> 2310
A45: =A43+14 -> 2299 | B45: - | C45: =C43+14 -> 2312 | F45: =F43+14 -> 2315 | I45: Thurs, | J45: =J43+13 -> 2323
A47: =A45+14 -> 2313 | B47: - | C47: =C45+14 -> 2326 | F47: =F45+14 -> 2329 | I47: Thurs, | J47: =J45+14 -> 2337
A49: =A47+14 -> 2327 | B49: - | C49: =C47+14 -> 2340 | F49: =F47+14 -> 2343 | I49: Thurs, | J49: =J47+14 -> 2351
A51: =A49+14 -> 2341 | B51: - | C51: =C49+14 -> 2354 | F51: =F49+14 -> 2357 | I51: Thurs, | J51: =J49+14 -> 2365
A53: =A51+14 -> 2355 | B53: - | C53: =C51+14 -> 2368 | F53: =F51+14 -> 2371 | I53: Thurs, | J53: =J51+14 -> 2379
A55: =A53+14 -> 2369 | B55: - | C55: =C53+14 -> 2382 | F55: =F53+14 -> 2385 | I55: Thurs, | J55: =J53+14 -> 2393
A57: =A55+14 -> 2383 | B57: - | C57: =C55+14 -> 2396 | F57: =F55+14 -> 2399 | I57: Thurs, | J57: =J55+14 -> 2407
A59: =A57+14 -> 2397 | B59: - | C59: =C57+14 -> 2410 | F59: =F57+14 -> 2413 | I59: Thurs, | J59: =J57+14 -> 2421
A63: * Paychecks dated November 25, 2005 will be available for pick-up on Monday, November 28, 2005.
A65: ** Reduced hours will be in effect from Tuesday Dec 20, 2005 through Friday Jan 13, 2006, and from Monday
A66: Mar 13, 2006 through Friday Mar 17, 2006, and from Friday May 12, 2006 through Friday Aug 25, 2006
A68: REMINDER! Federal regulations require that appointment authorizations with I-9 attachments must be submitted to
A69: the Sub-Board I Accounting Office for all newly hired employees within three business days from their first day
A70: of work!

A1: SUB-BOARD 1, INC.